review_id,stars,date,title,text,source,product,version,vote_count
14053988209,3,2026-05-11,Looks good I guess?,"The most recent major update does look slick but it's much less usable, a trend I'm not excited about at all.   My favorite thing about the app was that you open the home screen and you have your pinned trips and the subway map easily accessible.   Now you can only favorite a specific line at a station, and it will always default to showing only uptown trains for that line (regardless of whether that train actually has uptown trips from that station). Every time I need to see this info I have to open the app, swipe up to expand the trip info, and switch direction.   Station selection is also a huge pain now, meaning that you effectively *have* to have location access on unless you want to spend 5 minutes every time you want to check a station you don't frequently visit.   The maps have been completely hidden for some incomprehensible reason, now instead of a maps button on the GPS map you have to go to More -> subway maps.   None of this makes the app unusable but it makes it far less convenient, and when you're trying to frantically look up routes in the middle of a subway station convenience is at a premium. I will probably just download a pdf of the subway map and use google maps for times, because it's now just the simpler method.",app_store,MTA,4.8.0,0
14053818396,2,2026-05-11,new interface is unusable if you’re trying to plan in advance (2 stars for accuracy),"now it only shows you upcoming train times in your exact location, and you have to dig to view a specific station in that same transit line. that sounds nice on paper, but it’s really impractical and doesn’t allow for critical advance planning. many times i’m walking to a station further away, and i wanna know what time i’ll need to get there. other times i’m on a train with multiple viable transfers and i need to see which future transfer is coming the quickest, so that i know where to hop off. i ride on the E to 145, which means i can either get off at 7ave and take the D or i can get off at 42nd and take the A, that’s not information that you’ll receive if it’s only showing you nearby train stops.   favorites don’t save this either. for one, you run into the same issue, it’ll only show you the station nearest you, even within your favorites. but there’s another relating issue. i have multiple “favorite” locations, so i previously used the favorites tab often, but it’s a total mess. because it’s always trying to push you to train times near your location, the amount of text space that information takes up is a total waste of visual space for me and a one page list has turned into a constant scroll to find the train line i wanted to see.   the main issues (to me) with the old system was that it was buggy, and that you had a few too many tap throughs on the buses page to switch directions. now they’ve just added wayyy too many things to tap through to get to a basic piece of information.   this was my go-to app because it was the most reliable for exact times, but i’d rather an app be slightly off with an arrival time than be a waste of my time. it used to be simple and fast enough (when it wasn’t buggy) for me to check on future transfers while i was underground in-between stops, but i’d never be able to pull that with the redesign. i tried it for a few days and gave it a proper shot but i deleted it.   oh, and i almost forgot! they got rid of the widget! why???? that was so useful for getting quick information, and i could tap through to get more info on that specific train line. thankfully i found a better app that has it for free, but still. that alone made me want to delete the app.   new yorkers are fast and we need a fast app. keep it plain, simple and efficient",app_store,MTA,4.8.0,0
14053624090,2,2026-05-11,Please change it back,The previous version of this app was perfect. The new update is terrible. You sacrificed functionality for aesthetic. We can no longer see all of our favorited train stations and bus stops making it difficult to map out transfers. I am more interested in following the route I’m going to take daily than seeing random trains nearby. Please put back the option to list favorite stations and bus stops.,app_store,MTA,4.8.0,0
14053609735,1,2026-05-11,Still extremely frustrated,PLEASE bring back the old version of this app! This update makes it so much more difficult to use.,app_store,MTA,4.8.0,0
14052933506,1,2026-05-11,Lack of widget,Please bring it back,app_store,MTA,4.8.0,0
14052488112,1,2026-05-11,Wtf is this update,"Someone must have pressed the wrong button and taken the app back to its 2010 version. Usually when an app updates it’s supposed to add new features and functions, not take important ones away.",app_store,MTA,4.8.0,0
14052319853,2,2026-05-11,Not worth it.,Not worth it. Just go to the mta bustime subway website. Way easier to use.   It was a great  “look and go app” that worked awesome before the update.  I guess the powers that be decided they didn’t like that. Not surprised. Typical MTA move to Take something that works fine and improve it by making it worse.,app_store,MTA,4.8.0,0
14052276383,4,2026-05-11,Keep what works well,Having that easily accessible favorites tab was my favorite feature. I didn’t have to go around searching. It made my and my children’s commute efficient by helping up choose alternative routes when necessary. Bring back the tab!!,app_store,MTA,4.8.0,0
14052193926,2,2026-05-11,Please bring back widgets!,"What made this app standout from other transit apps was the ability to add widgets. Instead of opening an app, I could just swipe to one page that had all my commonly used routes. Removing widgets is a huge step back and I don’t see myself using this app moving forward anymore.",app_store,MTA,4.8.0,0
14051942868,1,2026-05-11,Downgrade,"I’ve held off on updating this app for as long as I could, as I liked the old UI and had no issues. Today it forced me to update as the older version wasn’t being supported any longer, and as many other users said, the app has gotten worse. I dislike how I only have a tab for nearby trains and how they are not labeled on the map. Please please please revert back to the original UI, as this one is much more tedious and confusing to use.",app_store,MTA,4.8.0,0
14050680573,1,2026-05-10,As bad as I feared,"I resisted updating because I knew it would be bad, when my fears were confirmed when I was forced to update. I lost all my favorites and am unable favorite certain stops. Terrible.",app_store,MTA,4.8.0,0
14050485388,1,2026-05-10,way worse,now why would you remove the ability to track buses?? and widgets??,app_store,MTA,4.8.0,0
14050151759,1,2026-05-10,Terrible update,The new update forces you to share your location and only shows the stations near by (or input your location). You can no longer simple select a line and see all the station. It is also confusing and not user friendly. I really hate that I was forced to update.,app_store,MTA,4.8.0,0
14050150140,1,2026-05-10,What is this mess?,"I can’t even see the buses. They’re in my favorites after I scroll past notifications of random buses, but when I tap on them, nothing happens and I can’t see the Bus map. What is the point of this?",app_store,MTA,4.8.0,0
14050094031,1,2026-05-10,Bus schedules suck,"Why do I have to click 10 different things just to get the bus routes to show up? The version before had it right, and you had to mess it up.",app_store,MTA,4.8.0,0
14049883271,1,2026-05-10,Disastrous update,"I agree with all the 1-star reviews. The new 2026 update is an absolute disaster. All my favorite stations are gone and there’s no way to search to get them back You can ONLY search for lines now, NOT stations. What the hell? Like many people mentioned already, I don’t always want to see “nearby” stations: I want to see an existing list of bookmarked stations, so I can plan my route better. This update doesn’t let you do that. What a joke! MTA, please PLEASE bring back the station search and favorite feature from the old version! This new version is so clunky and unusable now!",app_store,MTA,4.8.0,0
14048271038,2,2026-05-10,New Update Disappointment,"I updated the app and realized the widget no longer exists. I loved it, it was one of the best features. Deleting the app as it is not as convenient as it once was.",app_store,MTA,4.8.0,0
14045401820,1,2026-05-09,Frustrated,"This MTA app is very frustrating to use. Half the time it doesn’t update correctly, and you can’t even go on the bus or train location to see how far the bus is or track it properly. The timing is always off, which makes it hard to know when to leave or plan your trip. The app really needs better live tracking and more accurate updates.",app_store,MTA,4.8.0,0
14044678739,1,2026-05-09,Terrible update,"Every time I use this app, it’s just a terrible new design and it’s the most frustrating thing to use. All it did was just make it more difficult to find your stop",app_store,MTA,4.8.0,0
14043973623,2,2026-05-08,New Layout,Please go back to the old layout. The update is such an eyesore and usability is harder cause it’s harder. Please just go back to the old way it was and update the bugs. I wish I could un-update.,app_store,MTA,4.8.0,1
14039421172,2,2026-05-07,Please Revert!,"Please go back to the old version and design of this, this new one is very confusing.",app_store,MTA,4.8.0,1
14039027908,1,2026-05-07,Train status??,Where do I find the status of a train I’m not near by??,app_store,MTA,4.8.0,0
14038000845,3,2026-05-07,Widgets :(,Would be 5 if widgets had been included in the update. Please bring back widgets ASAP - was the main reason I used the MTA app over other map apps,app_store,MTA,4.8.0,0
14037948792,3,2026-05-07,The new version sucks,"The new version coming out May 2026 is missing some key feature I love. ""my favorite"" tab is one. And most importantly, number of people on board of a bus. I wish I didn't update.",app_store,MTA,4.8.0,1
14036107633,1,2026-05-06,Very Confusing,I find the UX on this new version to be very confusing and not to mention inaccurate. Doesn’t show nearest bus and the best feature was being able to see where a bus was on the route. That doesn’t seem to exist.,app_store,MTA,4.8.0,1
14035561059,3,2026-05-06,The latest update is worse,The plan my trip feature is worse. It gives worse results and the interface is worse. Plus you cannot save your favorite trip routes anymore. … wish they’d stop messing up stuff that doesn’t need updates.,app_store,MTA,4.8.0,0
14035552897,5,2026-05-06,Much better!,This app is worlds better than the previous. I use it everyday and have been very satisfied so far.,app_store,MTA,4.8.0,2
14032703690,1,2026-05-05,Latest update is,"Whoever was responsible for the latest update should be fired and never hired by another company again!!!  “Favorites” is ruined now, all my favorite routes are gone…instead of showing all my favorites routes it instead shows nearby routes only. This update is idiotic, ever heard the saying “if ain’t broken don’t fix it?” Yeah I don’t you have!",app_store,MTA,4.7.0,1
14032172271,1,2026-05-05,The new update has made the app much less useful for me,"This was my go to app for transit (checking train times and bus location on the map mostly), and this new update has made it much harder for me to get the info I need. I used to be able to search for a bus line and see every active bus on the map in both directions for that bus. I was also able to look up a subway line and see every stop easily for that line. With the new update, i can only search based on the bus or subway stop. I don't always know the bus stop, because even though I may know the bus's general route, I may not know the exact cross-streets of the bus stop closest to me and it requires extra investigation to figure that out. The app is now only useful for searching for a bus or train stop on a line I am very familiar with. Also, when I see the bus map, it doesn't even show the bus stops on the map anymore, which is pretty silly to me. It would greatly benefit me if the search functionality was the way it was before this last update. In general, I think it should line-based and less stop-based. Thank you.",app_store,MTA,4.7.0,1
14029172832,1,2026-05-04,Terrible Update,"Times for buses are wrong.  Says no bus for an hour and a half, then a bus is 5 minutes away.  Very unreliable.  Bring back the old version.",app_store,MTA,4.7.0,1
14028585980,1,2026-05-04,MTA Widgets,Give me my widgets back. Why did ygs delete the widgets option. I downloaded this app so I could put my bus times on my widgets and it disappeared within an update. I don't got the damn time to open the app and check myself.,app_store,MTA,4.7.0,0
14028192486,1,2026-05-04,Supremely frustrating,"I removed the app and reloaded it because it repeatedly required me to tap many times to change the date. This didn’t help. More importantly, when I put in a time of 10:42 for GCT to Beacon it said there was no information available!! Additionally, the old app allowed me to scroll through train times. Only 3 available through the new search function. All in all a super frustrating experience. Is there a way of going back to the old, very satisfying app experience? This “upgrade” really stinks.",app_store,MTA,4.7.0,0
14025780668,1,2026-05-03,Newest update,This newest update is trash,app_store,MTA,4.7.0,0
14022847079,1,2026-05-03,Terrible app,Only shows you the train times in your vicinity. Theres no clear way to pull up train times for the train you want. This new app/update completely ruined the MTAs app experience.,app_store,MTA,4.7.0,2
14014397637,3,2026-04-30,Most recent improvement messed up trip planning,I used to be able to play around with the exact train I’d be taking from select station during my trip. Nowadays it’s broken,app_store,MTA,4.7.0,0
14013802914,1,2026-04-30,New version = bad UI,"Trying again to use this app, but all I want to do is see the different routes simply I don’t care what’s near me. I am looking up something else, but this app forces you too look at the stops near you",app_store,MTA,4.7.0,0
14012943775,2,2026-04-30,Embarrassment to NYC,"Obviously built by the lowest bidder, and maintained by nobody, this app frequently displays incorrect arrival times that change dramatically and suddenly, making the times untrustworthy and therefore useless.  The chat feature randomly stops working.  NYC should have a useful, well-designed, FUNCTIONING app for this in the mid 2020s. What an embarrassment.  Also embarrassing for the developers. Truly shameful, low quality work.",app_store,MTA,4.7.0,0
14009791528,2,2026-04-29,Recent update,"It’s too cluttered, it won’t let you favorite mark stations which is dumb",app_store,MTA,4.6.0,0
14005850642,1,2026-04-28,Horrible update,"Like a lot of people, all I used it for was to see when a train was coming into a station.  I don’t have favorites or even know what station I’ll need when I’m out.  I used the app to click on a line, then went to the station list. Now that’s gone.  I wish I never updated.",app_store,MTA,4.6.0,0
14004241568,1,2026-04-27,Nice job,"You guys literally ruined this app - idk how you guys did it, but not a single thing is accurate anymore. Time jumps sporadically with or without delays and it makes this app so useless now.",app_store,MTA,4.6.0,0
14003492169,1,2026-04-27,Missing OMNY portal…,An app that does NOT incorporate the use of their own OMNY system swipe failures (missing transfers/double charges) is a Critchlow-failure. Zero-star rating.,app_store,MTA,4.6.0,0
14002381552,3,2026-04-27,Downgrade - widget function remmoved,Please add the widgets back. It was so convenient to just look at my home screen and see when my next train was coming as opposed to opening the app every time.,app_store,MTA,4.6.0,0
14002205411,4,2026-04-27,Widgets,While the app is much better with recent updates I really miss the widget component - really simplified and made looking up favorites so much easier.,app_store,MTA,4.6.0,0
13998258088,1,2026-04-26,UNUSABLE,I cannot express enough how terrible this is. Don’t you guys feel embarrassed?,app_store,MTA,4.6.0,0
13995816710,1,2026-04-25,New Design is Bad,"I don’t understand why companies change apps and take away functionality.  Favorited stations used to be in the status tab, now you have to go searching in a different tab for them.  Also, you used to be able to pick which train to see at the stations.  Now it shows you all the various lines at the station which is cluttered and unhelpful.  I used to be able to glance at this app quickly while walking to the train, now it’s a whole thing just to see when my train may be coming.  Whoever made this new design did a bad job.",app_store,MTA,4.6.0,0
13995636283,1,2026-04-25,Update sucks,The new update made it harder to use.,app_store,MTA,4.6.0,0
13995002279,1,2026-04-25,Use to be better before the update,"This app was one of the most accurate apps when it came to timing, but ever since the update not only is the app delayed which causes a lot of confusion checking for train stations schedules has become hard to navigate. I know most would agree",app_store,MTA,4.6.0,0
13993608214,5,2026-04-24,"Super intuitive, great work","Real time arrivals and transfer planning is a real game changer for me. Super accurate and useful. It’s become my go to transit app.  Great work, MTA!",app_store,MTA,4.6.0,1
13993599365,5,2026-04-24,Clean and Simple,I had a bit of trouble after I updated. I attempted 4 times due to having to adjust size of display. I finally succeeded I use large size on my SE MODEL phone.  Update Survey’s I didn’t mind until just now nearing the end it felt intrusive and I stopped answering. Definitely seeing those questions for the first time and quite disturbing 😳,app_store,MTA,4.6.0,0
13993428836,5,2026-04-24,Fab Upgrade,This app is wonderful!  I love the transfer functionality!   Great to see how long the wait for your next train is. If you could add bus transfers functionality as well it would be perfect!!!,app_store,MTA,4.6.0,0
13992925296,1,2026-04-24,The MTA is remarkably good at messing everything up,"Not sure why the app needed to be redone. Now I can’t add it as a widget and it doesn’t load half the time even with full service AND on wifi. Leave it to the MTA.  I NEVER review apps, but the MTA is such a joke in EVERYTHING they do. Literally can’t do ANYTHING right.",app_store,MTA,4.6.0,0
13992642254,1,2026-04-24,You said updates will be rolling out!,"The app is impossible. Where is my bus on the map? Where is the map? Just roll it back to the previous version, fire the developer who thought this update was a good idea and find someone who understands usability. Every update you all do makes the app worse.",app_store,MTA,4.6.0,0
13991997259,5,2026-04-24,Bring back the widgets!,The update has been wonderful other than the widgets disappearing! Please bring them back!,app_store,MTA,4.6.0,0
13991496796,1,2026-04-24,new update - took away favorite stations,why did the update take away the ability to check favorited stations as a list and instead make it reliant on user location? to force people to turn their location on? please bring that feature back and don’t do this again,app_store,MTA,4.6.0,1
13989412380,2,2026-04-23,App is nearly unusable,"The newest update has a cool new “streamlined” interface, but it traded away nearly all of its functionality. The 2025 version of the app was cumbersome, but usable. Now, it is nearly impossible to check train times at other stations, or to even designate specific stations in favorites. If you don’t want to hand over your location and identity data to NYC and other governmental entities, it might take 5+ minutes to get the transit info you want for your commute home. Even with location shared, you can only see train times for the closest station in your favorites. Also, the new app does not have an iOS widget, so they killed that feature too. Why, MTA, why?",app_store,MTA,4.6.0,1
13988275456,1,2026-04-23,Terrible upgrade,Who asked for this? This is very unfriendly and confusing. I want line information not closest option to me. Forcing location sharing is ridiculous.,app_store,MTA,4.5.0,1
13987370331,1,2026-04-22,New update ruined it,This used to be my go-to app for travel but the new update especially the map feature completely changed and ruined everything that was useful about this app and now I’m back to Apple Maps which is saying something,app_store,MTA,4.5.0,1
13986489458,1,2026-04-22,Not able to see the A train line and stations not happy with the change,Not planning to use any more,app_store,MTA,4.5.0,0
13986484362,1,2026-04-22,Terrible,Hated it. Downloaded for the bus scheduled. But that didn’t work at all. I don’t under why as Rich as NY is why can’t they get a solid working app. It’s 2026 why is it so hard to track a bus?,app_store,MTA,4.5.0,0
13986394531,3,2026-04-22,bad update,it was good until they updated now it’s confusing and hard to navigate,app_store,MTA,4.5.0,1
13986360164,1,2026-04-22,Arrival Times are an ILLUSION.,Was told the numbers don’t matter when it comes to arrival times. So what’s the point of this app.,app_store,MTA,4.5.0,0
13986266949,1,2026-04-22,Stupid update,Whoever decided to change the UI should be waterboarded for 1 week straight. It’s so bad. You have to tap a lot to find what you need.,app_store,MTA,4.5.0,1
13986104165,2,2026-04-22,When it works,Maybe it’s me but the trip planner is usually “not available “ and  it does not seem to provide a list of bus times  for a bracket of times.,app_store,MTA,4.5.0,0
13986040354,1,2026-04-22,Newest update makes it unusable,Iykyk,app_store,MTA,4.5.0,1
13985520935,2,2026-04-22,A poor downgrade,This version of the MTA app has reduced most of it previous facilities to a jumble of difficulty understand and incomplete list of information. It has also gotten rid of some of its most important and usable features such as favorite trips. Train and bus status no longer allows you to see all the stations of a particular line as before. very disappointing.,app_store,MTA,4.5.0,1
13983872899,3,2026-04-21,Back to Square 1,"This app was poorly made. The news was raving about it, when you lose signal on the train, your entire trip ends, and you have no idea where you’re going, and you can’t start a new trip because there’s no Wi-Fi in the subway stations and Solla are basically blind.",app_store,MTA,4.5.0,0
13982988565,1,2026-04-21,Latest update introduced terrible UI for plan trip,"I use the MTA daily and I use the app daily. The latest update is a major step back. The ""plan trip"" tab now has a horrible user experience. The font is too small although there are large sections of unused screen space. As if the developers didn't know anything about responsive/mobile design and just pulled in a page from the web interface. The map is hidden somewhere too. Please revert.",app_store,MTA,4.5.0,1
13981601463,1,2026-04-21,New update lost the widget function,"That was the most useful feature for this app, and it’s gone now - please bring it back!",app_store,MTA,4.5.0,0
13977790715,1,2026-04-20,Bus Times are all wrong,All of the bus times are incorrect. I’m going just off memory. Which is great when there’s a cancellation or a delay or something. Put it back.,app_store,MTA,4.5.0,0
13977646934,1,2026-04-20,Update made it worse.,"Since the major overhaul you’re no longer able to add a trip as a favorite. In fact there are no favorites in the plan a trip tab. Now every time you have to scroll through a drop down to choose a station to plan a trip. Updates are supposed to make your life easier, not more difficult.",app_store,MTA,4.5.0,1
13976142085,1,2026-04-19,Old version better,1) the bus section does not have a reverse direction   2) I don’t like that I can only see the buses near me. sometimes I’m looking at routes that I’m going to take later on. The old version was better where I could go in there and just select the line that I was gonna take. I don’t really like having everything pop up when I’m in there   3) I like the old version where you had a section with all of the bus stops and all of the subway stops where I could check on a subway or bus that I might take later on with their alerts and the whole route. It looks like your new version makes you favorite the train lines before you can see any additional information about them and I don’t like this because the favorites should just be my favorites if I wanted to have quick access to them to get more information. If I favorite everything then that’s too much information when I open the app.   This was not an improvement. This was a downgrade.   If you wanted to keep the app the same and then add that section with the location services that would’ve been fine but you took everything out and now you only have location service which won’t let me check routes or alerts on other lines I want to take later.   This is no longer functional for me so I’ve deleted the app,app_store,MTA,4.5.0,2
13974698654,1,2026-04-19,Why?,"The app was great until the latest update where it seems things were intentionally broken. I had to press 20-30 times on the translation to get it to display the times now, it’s more or less unusable now.",app_store,MTA,4.5.0,2
