review_id,stars,date,title,text,source,product,version,vote_count
13910994508,4,2026-04-01,Bring back the widgets!,"Great app, but I loved having the widgets on my home screen, and I’m disappointed that the new update removed them.",app_store,MTA,4.3.0,0
13910986973,1,2026-04-01,Features Disappear,Updates are rolling back new features. I wouldn’t update it. All of my widgets are now showing blank where they used to be populated.,app_store,MTA,4.3.0,0
13910782220,2,2026-04-01,Not great anymore,"Yeah, I’ve been using this since moving to NY. I’ve been here over a year now and what I loved about the app was that it saved locations for you so you could tap the app and it’ll go from your current location. I LOVED that. Now you go in and everytime you have to press your location and then where you want to go. There are no save route options. I’d like to point out I had about 13 destinations saved that were places I went to very regularly. When you go to pick your route it is hard to read. It looks bad.  It used to say how much time to transfer between stops without having to click it and everything. I also loved that I could actively watch my bus and where it is so make sure what I can catch and can’t catch. I have to click three separate pages to get there now. This is a lot and not in a good way. I know there were many notices saying the app was getting a big change but you would’ve thought for the better…not whatever this is.",app_store,MTA,4.3.0,2
13910728387,1,2026-04-01,Please bring back the widgets,The update is fine but why remove the widgets? It was essential for me daily. Please bring it back,app_store,MTA,4.3.0,0
13910651827,3,2026-04-01,Massively Tardy Assessments,"Too often doesn’t account for scheduled maintenance in ETAs and trip planning.  Almost always underestimates travel time by 5 - 15 minutes, even when only a single train line is involved WITHOUT delays",app_store,MTA,4.3.0,0
13910549507,1,2026-04-01,Always Worse,The MTA should fire the vendor developing this app for a failure to conduct appropriate user research and a desire to design for the majority rather than the plurality of users in our diverse city.  The removal of Home Screen widgets is unacceptable. And the change of the status page to organize it by line instead of by status is something the MTA app has already rolled back once. To do it again shows a failure to learn and a desire to obfuscate the failings of a deteriorating system.,app_store,MTA,4.3.0,2
13910490933,1,2026-04-01,Why remove Widgets ?,The newest update killed widgets - one of the best features of this app.  Bring it back!,app_store,MTA,4.3.0,0
13910447494,1,2026-04-01,Widgets gone?!,"Please bring back the Home Screen Widgets 🙏 they are extremely useful. Love the app, you guys really nailed the UX and look.",app_store,MTA,4.3.0,0
13910438176,1,2026-04-01,Bad update,You removed the ability to favorite specific bus and subway stops. This eased my hour+ long commute because I could pivot quickly when trains inevitably weren’t running or coming late. I can’t even search for stops on a route anymore. I’d have to go into the line and look for the stop to find out when the next train was coming if it wasn’t in my vicinity. Bring back favoriting stops.,app_store,MTA,4.3.0,1
13910341654,2,2026-04-01,Hate the update,Sad I have to delete this app now. Last update has moved everything to separate tabs instead of all in one tab.,app_store,MTA,4.3.0,0
13910173367,2,2026-04-01,"Great look, missing key features","The new app is visually striking and has a lot of potential. However the removal of key features vs the previous version is a real disappointment.  Widgets going away is a shame.  But the travesty is the new trip planning experience, which looks to be a funky web view Vs a native experience. Harder to use on mobile. No saved trips or locations makes it much less useful.  Bring back these features and it’s a 5 star for sure.",app_store,MTA,4.3.0,0
13910003053,1,2026-04-01,Change How Favorites are viewed,Better before the update. I should be able to check all stations in favorites without having to relocate the pin on the map or have my location on.,app_store,MTA,4.3.0,0
13909300748,1,2026-03-31,Widgets gone?,I found the widget the most useful part of the app. Frustrating that it's been removed.,app_store,MTA,4.2.0,0
13909193708,3,2026-03-31,Please stop changing things around,I promiseee the app was fine before why why why are we changing everything again,app_store,MTA,4.2.0,1
13908906618,1,2026-03-31,Ruined.,"First time ever reviewing an app. The MTA app was the fastest most efficient and most accurate transit planning app. Now, after the update the app is sluggish, cumbersome, and poorly designed. PLEASE revert to the previous version.",app_store,MTA,4.2.0,1
13908377832,1,2026-03-31,no widgets :(,Hey all - the app was previously incredible just for this feature. most useful new yorker thing to show you the next time your local train is arriving. please bring it back asap,app_store,MTA,4.2.0,0
13908188248,2,2026-03-31,Real-Time Bus Access Is No Longer Intuitive,"The recent update has made the app significantly less user-friendly, especially for bus riders.  Before, I could simply enter a bus line, tap it, and instantly view the route in real time. It was quick, efficient, and reliable, something I depend on daily to get to work.  Now, tapping the bus line takes me nowhere. I find myself tapping repeatedly with no clear way to access the real-time route information that used to be so easy to find. If the navigation has changed, it’s not intuitive at all.  This update has turned a simple, efficient process into a frustrating experience. For those of us who rely on accurate, real-time bus tracking, this is not an improvement; it’s a step backward.  Please consider restoring a more direct and user-friendly way to access real-time bus routes.",app_store,MTA,4.2.0,1
13908136969,1,2026-03-31,Just bus and subway now,"no more MNR and LIRR with new update, will be useless to a lot of users",app_store,MTA,4.2.0,0
13908109081,2,2026-03-31,Where did the widgets go?,"Great new GUI, but please bring back the widgets and station favorites! We don’t always travel uptown/downtown!",app_store,MTA,4.2.0,0
13908017825,3,2026-03-31,Pretty good,The app is good overall but the layout gets worse with every update.,app_store,MTA,4.2.0,0
13908016547,1,2026-03-31,Don’t install this if you rely on the My MTA App,"I use MyMTA, the previous version, for the bus info. You can easily see where a bus is on the route and plan the time you need to make it to the bus stop. Do not “upgrade” to this new app if you like the way MyMTA displays the info you need. The new interface wastes space. It’s colorful, which no one needs. You have to dismiss a useless map to actually see a bus route and the location of the buses.  January 2025: The latest update wiped out all the favorites that I had set up. Instead of my list of “Favorite” bus lines, I got a list of nearby bus stops. Please fire your developer and hire someone who actually uses the bus network. I’m thankful every day that I didn’t install this mess on my phone, only on one iPad. April 2026: everything that made the MyMTA app quick and clean and usable has been removed in favor of this mess, with useless map views and no easy access to saved favorites. Terrible design.",app_store,MTA,4.2.0,0
13907780463,1,2026-03-31,bring back widgets,bring back widgets,app_store,MTA,4.2.0,0
13907633773,5,2026-03-31,Widget Next?,This redesign is incredible! Would love to see a widget that shows me train times and service changes for my nearest subway stop.,app_store,MTA,4.2.0,0
13907513433,1,2026-03-31,Utterly Useless,1st. The app only works if you have precise location enabled.  They reduced a very useful app to a sad tracking device.,app_store,MTA,4.2.0,0
13907484408,2,2026-03-31,UI change,Original UI was a lot easier to navigate and showed more info,app_store,MTA,4.2.0,0
13907455742,1,2026-03-31,Removing widgets shows such incompetence,Why would you remove the one feature people liked?? Such terrible developers,app_store,MTA,4.2.0,0
13907332318,1,2026-03-31,BRING BACK WIDGETS,The new app is much better in every way except my home screen widgets DISAPPEARED! The widgets were the best part of the MTA app! Please bring them back ASAP!,app_store,MTA,4.2.0,0
13907222318,1,2026-03-31,Why remove the widget?,"They got rid of the train time widgets, which was why I used this app. It's also harder to see my favorite stations. Big regression.",app_store,MTA,4.2.0,0
13907105520,1,2026-03-31,New update,The new update changed everything I needed and loved about the old app. This update is garbage.,app_store,MTA,4.2.0,0
13906766863,1,2026-03-31,Horrible!,"Bring back the previous version! This just looks like the website version now, can’t easily see all favorite stops and save trips! I have to find another app to use now",app_store,MTA,4.2.0,1
13906754917,1,2026-03-31,"Ruined app with new version, no option to choose the line and station train time anymore","No option to choose the line and station train time like the previous version, only location detecte",app_store,MTA,4.2.0,0
13906576398,1,2026-03-31,MTA,"I had this app and loved it, you upgraded it and now no matter what I do it doesn’t open…even went to Verizon and they had no idea why this is happening..very frustrating and disappointing",app_store,MTA,4.2.0,0
13906470421,1,2026-03-31,Bring back widgets,"I feel bad leaving a 1 star review because I am sure some people worked hard on this new version, but this is not an improvement. I was a beta tester for this version and consistently left feedback that the widgets are important. It’s very unfortunate this version was released without them. It’s not at all surprising to see all the negative reviews asking for them back though. I use the widgets far more than I use the actual app. I use to tell people how great the MTA app is. I can no longer recommend it. You need to bring back the native widgets. Additionally, if the trip planner is a web view, like it is in the version I beta tested (I have not updated yet, i turned off auto updates when I heard the new version was released without widgets), that needs to be a native feature. The web view is not great.",app_store,MTA,4.2.0,1
13906423463,4,2026-03-31,Please add back time of arrival,Previous version allow to see not only minutes till next train but time of arrival as well. Somehow I feel time better than minutes. Please return this feature back,app_store,MTA,4.2.0,0
13906421716,1,2026-03-31,Worst Update Ever,Can no longer see train times by line,app_store,MTA,4.2.0,0
13905635744,1,2026-03-30,No more favorites,All my favorites are gone and no longer work properly,app_store,MTA,4.2.0,0
13905284235,1,2026-03-30,Fix this garbage asap,This is perhaps the worst “update” to any app in recent memory. How is it even possible to make an app more convoluted and confusing? Just to see the route of a subway line is buried in a series of annoying minutiae. The list goes on but it’s frankly not worth my time. The app is also ugly. Go back to the one before this.,app_store,MTA,4.2.0,0
13904329275,1,2026-03-30,Wow so bad,"Whoever signed off the latest update should be placed on a PIP. What’s the point of simply changing the appearance while removing the only useful features? Now I gotta go back to using GoogleMaps. Seriously, stop wasting money on these useless updates and complaining to taxpayers that MTA is losing money. And stop pretending to be a tech company",app_store,MTA,4.2.0,1
13903950022,1,2026-03-30,Don’t update,Went from a great and reliable app to unusable. Why? Can we just not have good things?,app_store,MTA,4.2.0,0
13903741746,5,2026-03-30,Great redesign!,"Much more responsive on map panning, and most important information is most prominent.",app_store,MTA,4.2.0,0
13903241858,1,2026-03-30,REMOVED THE WIDGETS,"Why, why, why???",app_store,MTA,4.2.0,1
13903227954,1,2026-03-30,Why???,"Before the latest update, the MTA app was shockingly good. So many useful features are now gone.",app_store,MTA,4.2.0,0
13902900957,5,2026-03-30,Please Bring Back Widget,"The new app is great, but please bring back the MTA widget. That was an essential for me every day.",app_store,MTA,4.2.0,0
13902530876,1,2026-03-30,New Update,This new update is awful. Completely unnecessary. Why would you mess with an already great app. It’s basically unusable and useless now. If I could give 0 stars I would.,app_store,MTA,4.2.0,1
13902103895,1,2026-03-29,Widgets Lost,"Best thing about the app was the widgets, please bring it back. App is completely useless now.",app_store,MTA,4.2.0,1
13901797921,1,2026-03-29,Removed widget functionality,The widget that showed arrival information broke with the update in March 2026.,app_store,MTA,4.2.0,1
13901527255,2,2026-03-29,Favorite trips removed,I updated my app to get the new version and was very disappointed to see my favorite trips were removed and now the option to favorite my most common commutes is gone. Boo. Bring it back pls,app_store,MTA,4.2.0,0
13901273485,3,2026-03-29,"Update is great, but widget removed?","I typically use the widgets to see a dashboard of my most used stations, next trains, etc. but I feel that the majority of the functionality  of the app was just removed…why?",app_store,MTA,4.2.0,1
13901240354,1,2026-03-29,Update is worse,The update is much worse for me in regards to favorites. It lets me save favorite lines/busses only but not stations. Also it is not letting me save favorite trips which I use regularly. Please add these back!,app_store,MTA,4.2.0,0
13901171382,1,2026-03-29,New update is awful,Just ruined the app with the new update,app_store,MTA,4.2.0,0
13901167445,1,2026-03-29,No schedules,I just want to see what time the train is leaving.  They have the times in the stations on the screens. Why not in the app??,app_store,MTA,4.2.0,0
13901102626,2,2026-03-29,Need Widgets Back!,"App is getting better but why remove the widgets on IOS?! Really clunky to have to open the app now to get info. Seems like a backwards move, please bring back asap!!",app_store,MTA,4.2.0,1
13900000094,1,2026-03-29,Widgets gone,It’s a great app but the widgets based on favorite lines and stops are crucial.,app_store,MTA,4.2.0,0
13899769761,1,2026-03-29,Horrible update,I hardly ever write reviews but this app had such a downgrade in functionality after its update. Literally any other MTA tracker is more convenient than this hot piece of garbage.,app_store,MTA,4.2.0,0
13899605135,1,2026-03-29,Bring back widgets!,"Yes, the new features inside the app are better than the old app, but at this point I primarily relied on this app for the widgets!! PLEASE BRING THEM BACK! I miss not being able to glance at my screen and see if there’s any issues with my train line or not.",app_store,MTA,4.2.0,0
13898503750,1,2026-03-28,Zero star,"The appearance is the worst and they removed all the useful features, what are you even upgrading? If you cant make something good you need to give the previous version back.",app_store,MTA,4.2.0,2
13898286135,2,2026-03-28,Can I go back the last app?Update.,We should have a choice to go back to old versions. My favorites are gone. User interface is not so user friendly. Can’t edit favorite/commute stations Update after using app for a week of commuting; your favorites or what you take to commute everyday show when you click search and see the history of the train/bus you searched for and starred. Turn off locations so the app doesn't keep showing you nearest stations. That's more for tourists or new New Yorkers. Veterans already know where they're going. I give them props for tracking  which is better than last app.,app_store,MTA,4.2.0,0
13898184852,4,2026-03-28,"Great UI improvements, but missing a feature","Making a station a favorite really needs to have the ability to just show the line/direction you care about. Otherwise, great job!",app_store,MTA,4.2.0,0
13896939187,2,2026-03-28,Favorite Trips Lost in Update,Bring back favorite trips. Being able to time commutes was one of the most helpful parts of the previous app version.,app_store,MTA,4.2.0,1
13896253043,5,2026-03-28,Nice job!,"I give you 5/5 because This is to reward your bravery. I can't believe you actually had the audacity to push out this new version of the software. Removing the ability to view other subway lines—leaving users able to see only the lines nearby—is just *so* cool! Your software team is like someone who has never eaten a hamburger in their life; the product you’ve churned out has no cheese, and certainly none of that juicy beef. Keep doing nothing 🫡🫡🫡",app_store,MTA,4.2.0,5
13896222260,1,2026-03-28,"Was Good, Now Not",The recent update removed and/or broke the features I used daily. Sigh…,app_store,MTA,4.2.0,3
13896117170,1,2026-03-28,So much worse,"This new update makes the app 1000% less useful. I used to be able to get information about any mode of transportation, metro north, lirr, bus, subway, even the jfk AirTrain, in the most simple, accurate and easy to use format. This update gets rid of all of that!! Absolute incompetence in knowing what is useful for people by the MTA but what else should I expect.",app_store,MTA,4.2.0,3
13896085743,1,2026-03-28,New update sucks,This new update sucks i feel like its more work then before  to plan my trip it also shows less options the old app showed at least 7-8 up coming tomes after the closest  the old app just looks better,app_store,MTA,4.2.0,3
13895877715,1,2026-03-28,Widgets are gone,Widgets were one of the best features of the previous app. Please add them back to the new version of the app!,app_store,MTA,4.2.0,2
13894946849,1,2026-03-27,Bring back widgets,Widgets were added and then removed why?,app_store,MTA,4.2.0,2
13894943957,1,2026-03-27,Regret I updated,This version wrecked my favorites! I had reasons for favoriting the subway & bus lines I did. Stations too. Now favorites shows me irrelevant buses and trains that I’m not interested in. Some aren’t even close to my location. Bring back how it worked before!,app_store,MTA,4.2.0,2
13894852571,1,2026-03-27,Where are the widgets?,Latest update got rid of widgets. That was the best part of the app. Bring them back please.,app_store,MTA,4.2.0,1
13894841568,4,2026-03-27,Nice,Works well. Please add widgets for favorite stops/lines so I can easily check when the next one arrives,app_store,MTA,4.2.0,1
13894419728,1,2026-03-27,Where did the Express Busses go?,Somehow they found a way to make the app even *worse*!,app_store,MTA,4.2.0,2
13894208810,5,2026-03-27,The new app is awesome,"The revamped MTA app is incredible! It’s so quick, the UI is very user friendly, and the navigation features are great. I also love how easy it is to see bus info and stations, and the “swap direction” feature.",app_store,MTA,4.2.0,1
13893962286,2,2026-03-27,Widgets are missing,Old app was better. Bring back widgets.,app_store,MTA,4.2.0,1
13893877448,4,2026-03-27,Big Up,I’m loving this all-new subway and bus experience on the app (v4.1.0); smooth like butter.  🗽 PS I'll give you guys five stars in the future when I’m able to access my OMNY account in the app or something like that.,app_store,MTA,4.2.0,1
13893807051,1,2026-03-27,Unusable,Why do you fix something that isn’t broken? Why do you add convoluted niche features while removing the simple basic ones?,app_store,MTA,4.2.0,1
13893293159,1,2026-03-27,Horrible update,Removal of widgets is beyond frustrating and a terrible UX decision.,app_store,MTA,4.2.0,1
13893239751,1,2026-03-27,Removed Widgets???!?!,"One of the primary tenets of product management is to Do No Harm, meaning any update you make should not be at the detriment of the current users experience.   The MTA has violated this in such a major way. Widgets were something I used MULTIPLE TIMES PER DAY. Without these widgets, the MTA app is essentially pointless. I can use Google or Apple Maps to do everything else… quick access to train arrival ETA is now essentially non-existent.",app_store,MTA,4.2.0,1
13892310836,1,2026-03-27,New update gets 0 stars if I could,"Not sure what prompted this new update, but if there’s no alerts on your train or bus, you can’t even check the status. The old app lets you see what stop the train or bus was at, and what time if you get to your stop. It was soooo useful especially for planning your commute and now this app is useless. Based on other recent reviews, you guys should add those features back or fix the app.",app_store,MTA,4.2.0,2
13892294882,1,2026-03-27,Where did widget go,"No widgets in update, huge bummer",app_store,MTA,4.2.0,2
13892035917,1,2026-03-27,Update is TRASH,How is it that the new update is worse than the previous one?! The “plan trip” tab is confusing compared to the last version. Doesn’t clearly show what time the bus/train will be arriving/departing. On top of that all my favorites from the previous version were no transferred. Come on!,app_store,MTA,4.2.0,1
13891604312,1,2026-03-26,why remove widget option?,redesign is great except there’s no longer a widget that shows arrival times? was my most used feature,app_store,MTA,4.2.0,2
13891392609,1,2026-03-26,Widgets,Bring back the widgets. This was the best part of the app. Now the widgets are gone. Bring back the  widgets!!!!,app_store,MTA,4.2.0,2
13891309416,1,2026-03-26,Too big for small screen,I have a smaller iPhone and this updated version crops out the bottom buttons so I CANNOT use it as I can’t click on (or see) whatever is on the bottom,app_store,MTA,4.2.0,0
13891168572,1,2026-03-26,new update sucks,"why do i find out that the app redesign is so bad? I cant do anything anymore. I dont just want to see the stations around me or alerts, I WANT TO SEE THE WHOLE ROUTE!! I cant with this. Let me atleast download an older version of the app 🤦",app_store,MTA,4.2.0,0
13890765534,1,2026-03-26,So many lost and useless features with recent update,"No more widgets, buses and trains are in separate tabs rather than a filter to switch between the two, no saved locations/trips when using plan a trip and the plan a trip feature is now just a cheap insert from the website. The plan a trip is clunky, doesn’t have dark mode, and doesn’t tell you bus/arrival times, just that they’re x minutes away.   Bring the old app back",app_store,MTA,4.2.0,1
13889910254,5,2026-03-26,bring the old interface back fr,the app itself is good but bro i HATE the new update change that shi back😭😭😭🙏🙏🙏,app_store,MTA,4.2.0,0
13889257988,3,2026-03-26,"Widgets, Trip Planner, and Push Notifications",We need a better trip planner that integrates with rest of the app. Such as ability to favorite a specific trip. Otherwise great app.,app_store,MTA,4.2.0,1
13888830713,4,2026-03-26,"Crispy app, but where did the widget go?","Love the new features of the new app, but why did you get rid of the widget? It was so nice to see on my home screen the next departures.",app_store,MTA,4.2.0,1
13888826264,3,2026-03-26,New update removed key feature for me,I wish i had known before updating or i wouldn’t have. the new update gave the entire app a facelift which so far seems great…. aside from the removal of the iphone widgets!! i used this feature every day and i don’t understand the removal. the app showed you the train times from your favorite stations right on the home screen! really hope this is brought back in a future update,app_store,MTA,4.2.0,2
13888471089,2,2026-03-26,railroad,what happened to metro north and lirr in the update? can no longer check the status,app_store,MTA,4.2.0,0
13887781217,4,2026-03-25,New app is missing widgets,"Old app had widgets which I used and were very useful to me. The new app is missing the widgets. While the new app is much better than the old app, the  missing widgets need to be restored. Please restore them as soon as possible.",app_store,MTA,4.2.0,1
13887681120,3,2026-03-25,Eh,"It’s accurate, but why they still don’t include direction the bus is going on the main screen of how far the bus is with the times? You have to guess if the one you click on will be heading north or south",app_store,MTA,4.2.0,0
13887567072,1,2026-03-25,4.2 Update disappointing,"Please go back there the previous version. It was so much better than the current version, 4.2.",app_store,MTA,4.2.0,0
13887540664,1,2026-03-25,Needs lots of work on the new version,Unable to select station time arrival like the old app. Please put back both time arrival and minutes until next train as it’s complicate,app_store,MTA,4.2.0,0
13887461992,1,2026-03-25,laggy mess,"the new update is so much laggier than the old app, it’s become borderline unusable when this used to be the number one app i would use for transit :( please revert or fix how slow it is",app_store,MTA,4.2.0,0
13887434094,1,2026-03-25,Downgrade,Very disorganized. No more lirr status or widgets,app_store,MTA,4.2.0,0
13887372918,1,2026-03-25,Bring Back Widgets,Please bring back the widgets. It was such an important feature.,app_store,MTA,4.2.0,1
13887080403,1,2026-03-25,Terrible update,How do you make the UI WORST?!?,app_store,MTA,4.2.0,0
13886853013,1,2026-03-25,Removed the only useful feature.,"The old version of the app let you see both your favorite bus stations and subways on one tab. Now you can not. Literally no reason to use the app anymore, thanks MTA 💀",app_store,MTA,4.2.0,1
13886463420,2,2026-03-25,Ok but…,I recently updated this app and found out that my departure status widgets for the LIRR no longer appear. MTA please fix this or add a widgets function to the TrainTime app for iPhone.,app_store,MTA,4.2.0,0
